{
  "schema": "dna-premium-articulation-plan",
  "version": "2.0",
  "source": {
    "inputMidiSha256": "eda42af1d74ddeec792a56b09557a80ddcf8369e5ea3885a4520574e31572975",
    "groovePlanHash": "0f437631eb9c1939fddf7f164b108abcd0276fef07ebe55bcced224aa546b3aa",
    "expressionPlanHash": "06e2c6a4b716efb2821815c72105fac5dd81bbc9d35414ca329eef418ad70879",
    "catalogHash": "e1cb74dc0bb552fb18f1bb1a7048d0207bdf35504814713ed7686c15a7eed12a"
  },
  "controls": {
    "version": "1.0",
    "mapId": "250.020.001",
    "trackUid": "trk-7011fbb5d9807ae262bf",
    "trackNumber": 3,
    "channelNumber": 3,
    "startTick": 0,
    "endTick": 2640,
    "role": "solo",
    "requestedArticulations": [
      "fret_noise",
      "release_noise",
      "proprietary_noise"
    ],
    "seed": 2525,
    "allowSharedChannel": false,
    "productionMode": false,
    "maxGeneratedEvents": 64
  },
  "map": {
    "mapId": "250.020.001",
    "engine": "RX",
    "status": "CONFIRMED",
    "authority": "SOFTWARE_TEST_ONLY",
    "captureHash": "5bbfa17959599265f0aa12b6cec0cd84b8cd8d911f4900bbf37b8fa4fef08e32",
    "exactSound": {
      "bankMsb": 121,
      "bankLsb": 1,
      "program": 40
    },
    "productionEligible": false
  },
  "soundBinding": {
    "schema": "dna-premium-sound-binding",
    "version": "2.0",
    "trackUid": "trk-7011fbb5d9807ae262bf",
    "trackIndex": 2,
    "trackNumber": 3,
    "channelIndex": 2,
    "channelNumber": 3,
    "startTick": 0,
    "endTick": 2640,
    "bankMsb": 121,
    "bankLsb": 1,
    "program": 40,
    "complete": true,
    "status": "EXACT_MAP_MATCH"
  },
  "sourceNotes": [
    {
      "sourceNoteUid": "srcnote-9d8c59365d47a0659e4201ae",
      "onsetTick": 240,
      "durationTick": 720,
      "pitch": 60,
      "velocity": 72,
      "immutable": true
    },
    {
      "sourceNoteUid": "srcnote-f7edbee4fa2e320591dc0449",
      "onsetTick": 720,
      "durationTick": 360,
      "pitch": 67,
      "velocity": 73,
      "immutable": true
    },
    {
      "sourceNoteUid": "srcnote-c82bd785990709a8efbd8fa7",
      "onsetTick": 1200,
      "durationTick": 720,
      "pitch": 64,
      "velocity": 74,
      "immutable": true
    },
    {
      "sourceNoteUid": "srcnote-8bed5e95051f07e3de8f2084",
      "onsetTick": 1680,
      "durationTick": 360,
      "pitch": 72,
      "velocity": 75,
      "immutable": true
    }
  ],
  "events": [
    {
      "eventId": "art-84c263705a7fadaa438a9dc7",
      "mapId": "250.020.001",
      "articulationId": "250.200.001",
      "articulation": "fret_noise",
      "engine": "RX",
      "status": "CONFIRMED",
      "eventType": "KEYSWITCH",
      "trackUid": "trk-7011fbb5d9807ae262bf",
      "trackNumber": 3,
      "channelNumber": 3,
      "tick": 968,
      "noteOffTick": 1016,
      "number": 12,
      "value": null,
      "sourceNoteUid": "srcnote-9d8c59365d47a0659e4201ae",
      "sourceEvidenceId": "250.900.004",
      "reasonCode": "EXACT_RX_LONG_NOTE",
      "productionEligible": false,
      "eventHash": "53578c4e17d8178f6d0686bb0770ef5c70452b581c42c7c563e16649e74087f6"
    },
    {
      "eventId": "art-a625b5cbaf1398c356bebee6",
      "mapId": "250.020.001",
      "articulationId": "250.200.001",
      "articulation": "fret_noise",
      "engine": "RX",
      "status": "CONFIRMED",
      "eventType": "KEYSWITCH",
      "trackUid": "trk-7011fbb5d9807ae262bf",
      "trackNumber": 3,
      "channelNumber": 3,
      "tick": 1928,
      "noteOffTick": 1976,
      "number": 12,
      "value": null,
      "sourceNoteUid": "srcnote-c82bd785990709a8efbd8fa7",
      "sourceEvidenceId": "250.900.004",
      "reasonCode": "EXACT_RX_LONG_NOTE",
      "productionEligible": false,
      "eventHash": "5fdadbcb0a16aeb886821ac73461d5db92a714e6d2527712a49451dae3dfb024"
    },
    {
      "eventId": "art-ca7b9268a4fac79115d31e63",
      "mapId": "250.020.001",
      "articulationId": "250.200.002",
      "articulation": "release_noise",
      "engine": "RX",
      "status": "CONFIRMED",
      "eventType": "KEYSWITCH",
      "trackUid": "trk-7011fbb5d9807ae262bf",
      "trackNumber": 3,
      "channelNumber": 3,
      "tick": 2040,
      "noteOffTick": 2088,
      "number": 13,
      "value": null,
      "sourceNoteUid": "srcnote-8bed5e95051f07e3de8f2084",
      "sourceEvidenceId": "250.900.005",
      "reasonCode": "EXACT_RX_PHRASE_END",
      "productionEligible": false,
      "eventHash": "08255b68b4dc021814b12489422e5645c0e2dad1c7e7df8d875e80d2f2eab2e5"
    }
  ],
  "audit": {
    "sourceNoteCount": 4,
    "requestedArticulationCount": 3,
    "generatedEventCount": 3,
    "keyswitchEventCount": 3,
    "ccEventCount": 0,
    "channelPressureEventCount": 0,
    "keyswitchNoteOffCount": 3,
    "baselinePeak": 18,
    "articulationPeak": 1,
    "estimatedPeak": 19,
    "softwareMidiNoteCeiling": 54,
    "withinPolyphonyCeiling": true,
    "skipped": {
      "STATUS_BLOCKED": 1
    },
    "duplicateEventCount": 0
  },
  "productionBlocks": [
    {
      "code": "SOFTWARE_TEST_FIXTURE_CANNOT_AUTHORIZE_PA800_PRODUCTION",
      "reason": "Articulation trigger map is not backed by operator-approved physical Pa800 capture."
    },
    {
      "code": "UNCONFIRMED_REQUESTED_ARTICULATION",
      "reason": "UNKNOWN/BLOCKED articulations remain KEEP/MANUAL_REVIEW and emit no trigger."
    }
  ],
  "readyForPreview": true,
  "readyForProductionRender": false,
  "finalMidiGenerated": false,
  "midiMutationAllowed": false,
  "articulationPlanHash": "dbfc6b26aa716ba45ec2ca6e4353941ecd78cecaaafeff71efe67348e736b46a"
}
