{
  "schema": "dna-premium-articulation-plan",
  "version": "2.0",
  "source": {
    "inputMidiSha256": "eda42af1d74ddeec792a56b09557a80ddcf8369e5ea3885a4520574e31572975",
    "groovePlanHash": "0f437631eb9c1939fddf7f164b108abcd0276fef07ebe55bcced224aa546b3aa",
    "expressionPlanHash": "06e2c6a4b716efb2821815c72105fac5dd81bbc9d35414ca329eef418ad70879",
    "catalogHash": "e1cb74dc0bb552fb18f1bb1a7048d0207bdf35504814713ed7686c15a7eed12a"
  },
  "controls": {
    "version": "1.0",
    "mapId": "250.030.001",
    "trackUid": "trk-91223ae1e5498bd7ed27",
    "trackNumber": 4,
    "channelNumber": 4,
    "startTick": 0,
    "endTick": 2640,
    "role": "solo",
    "requestedArticulations": [
      "legato_switch",
      "breath",
      "fall_pressure"
    ],
    "seed": 2525,
    "allowSharedChannel": false,
    "productionMode": false,
    "maxGeneratedEvents": 64
  },
  "map": {
    "mapId": "250.030.001",
    "engine": "DNC",
    "status": "CONFIRMED",
    "authority": "SOFTWARE_TEST_ONLY",
    "captureHash": "5bbfa17959599265f0aa12b6cec0cd84b8cd8d911f4900bbf37b8fa4fef08e32",
    "exactSound": {
      "bankMsb": 121,
      "bankLsb": 2,
      "program": 80
    },
    "productionEligible": false
  },
  "soundBinding": {
    "schema": "dna-premium-sound-binding",
    "version": "2.0",
    "trackUid": "trk-91223ae1e5498bd7ed27",
    "trackIndex": 3,
    "trackNumber": 4,
    "channelIndex": 3,
    "channelNumber": 4,
    "startTick": 0,
    "endTick": 2640,
    "bankMsb": 121,
    "bankLsb": 2,
    "program": 80,
    "complete": true,
    "status": "EXACT_MAP_MATCH"
  },
  "sourceNotes": [
    {
      "sourceNoteUid": "srcnote-c4fe2da726f05543aaac84ba",
      "onsetTick": 240,
      "durationTick": 720,
      "pitch": 64,
      "velocity": 72,
      "immutable": true
    },
    {
      "sourceNoteUid": "srcnote-593039cc14ea97367150f284",
      "onsetTick": 720,
      "durationTick": 360,
      "pitch": 71,
      "velocity": 73,
      "immutable": true
    },
    {
      "sourceNoteUid": "srcnote-31a3b5205e7a1e65fc5e45f8",
      "onsetTick": 1200,
      "durationTick": 720,
      "pitch": 69,
      "velocity": 74,
      "immutable": true
    },
    {
      "sourceNoteUid": "srcnote-919fc26fce559d2e4f1be4db",
      "onsetTick": 1680,
      "durationTick": 360,
      "pitch": 76,
      "velocity": 75,
      "immutable": true
    }
  ],
  "events": [
    {
      "eventId": "art-72e012fbbe29ecbea3086733",
      "mapId": "250.030.001",
      "articulationId": "250.300.001",
      "articulation": "legato_switch",
      "engine": "DNC",
      "status": "CONFIRMED",
      "eventType": "KEYSWITCH",
      "trackUid": "trk-91223ae1e5498bd7ed27",
      "trackNumber": 4,
      "channelNumber": 4,
      "tick": 696,
      "noteOffTick": 744,
      "number": 20,
      "value": null,
      "sourceNoteUid": "srcnote-593039cc14ea97367150f284",
      "sourceEvidenceId": "250.900.007",
      "reasonCode": "EXACT_DNC_LEAP",
      "productionEligible": false,
      "eventHash": "7023668b1abd1bc7eab7d67b9efb13fd8b62f59a4fbb443a87917a437b48eb43"
    },
    {
      "eventId": "art-82fb3b46c5d7a5ce489fc104",
      "mapId": "250.030.001",
      "articulationId": "250.300.001",
      "articulation": "legato_switch",
      "engine": "DNC",
      "status": "CONFIRMED",
      "eventType": "KEYSWITCH",
      "trackUid": "trk-91223ae1e5498bd7ed27",
      "trackNumber": 4,
      "channelNumber": 4,
      "tick": 1656,
      "noteOffTick": 1704,
      "number": 20,
      "value": null,
      "sourceNoteUid": "srcnote-919fc26fce559d2e4f1be4db",
      "sourceEvidenceId": "250.900.007",
      "reasonCode": "EXACT_DNC_LEAP",
      "productionEligible": false,
      "eventHash": "52745956cb24c267fd2a3d791c02dfee0b4a80f3c75c69e7813bc3c0fe06018e"
    },
    {
      "eventId": "art-8bfe72fc89bc1d0e167a2df7",
      "mapId": "250.030.001",
      "articulationId": "250.300.002",
      "articulation": "breath",
      "engine": "DNC",
      "status": "CONFIRMED",
      "eventType": "CC",
      "trackUid": "trk-91223ae1e5498bd7ed27",
      "trackNumber": 4,
      "channelNumber": 4,
      "tick": 240,
      "noteOffTick": null,
      "number": 1,
      "value": 96,
      "sourceNoteUid": "srcnote-c4fe2da726f05543aaac84ba",
      "sourceEvidenceId": "250.900.008",
      "reasonCode": "EXACT_DNC_LONG_NOTE",
      "productionEligible": false,
      "eventHash": "a4285d985053733d2616526f86fc3d75d6aa1302495006d3f44a4cd379549307"
    },
    {
      "eventId": "art-ddaabe4a873a01487190c148",
      "mapId": "250.030.001",
      "articulationId": "250.300.002",
      "articulation": "breath",
      "engine": "DNC",
      "status": "CONFIRMED",
      "eventType": "CC",
      "trackUid": "trk-91223ae1e5498bd7ed27",
      "trackNumber": 4,
      "channelNumber": 4,
      "tick": 1200,
      "noteOffTick": null,
      "number": 1,
      "value": 96,
      "sourceNoteUid": "srcnote-31a3b5205e7a1e65fc5e45f8",
      "sourceEvidenceId": "250.900.008",
      "reasonCode": "EXACT_DNC_LONG_NOTE",
      "productionEligible": false,
      "eventHash": "c3bc30800392fe45db7208ff3d4d46583ee0aaa9f9d48cd0b2b7bdff4f40b02a"
    },
    {
      "eventId": "art-2310c22b6aa6c594fe010047",
      "mapId": "250.030.001",
      "articulationId": "250.300.003",
      "articulation": "fall_pressure",
      "engine": "DNC",
      "status": "CONFIRMED",
      "eventType": "CHANNEL_PRESSURE",
      "trackUid": "trk-91223ae1e5498bd7ed27",
      "trackNumber": 4,
      "channelNumber": 4,
      "tick": 2040,
      "noteOffTick": null,
      "number": null,
      "value": 80,
      "sourceNoteUid": "srcnote-919fc26fce559d2e4f1be4db",
      "sourceEvidenceId": "250.900.009",
      "reasonCode": "EXACT_DNC_PHRASE_END",
      "productionEligible": false,
      "eventHash": "2deb0953e2dac8628ca652937f1c3ddd08404bbcdd6d014fc1a0b73222bd2c7c"
    }
  ],
  "audit": {
    "sourceNoteCount": 4,
    "requestedArticulationCount": 3,
    "generatedEventCount": 5,
    "keyswitchEventCount": 2,
    "ccEventCount": 2,
    "channelPressureEventCount": 1,
    "keyswitchNoteOffCount": 2,
    "baselinePeak": 18,
    "articulationPeak": 1,
    "estimatedPeak": 19,
    "softwareMidiNoteCeiling": 54,
    "withinPolyphonyCeiling": true,
    "skipped": {},
    "duplicateEventCount": 0
  },
  "productionBlocks": [
    {
      "code": "SOFTWARE_TEST_FIXTURE_CANNOT_AUTHORIZE_PA800_PRODUCTION",
      "reason": "Articulation trigger map is not backed by operator-approved physical Pa800 capture."
    }
  ],
  "readyForPreview": true,
  "readyForProductionRender": false,
  "finalMidiGenerated": false,
  "midiMutationAllowed": false,
  "articulationPlanHash": "203f237f0bc3aeb6fc41331d072ec4ecb215399574b9fc872711880f9f387de4"
}
